{
  "schemaVersion": "session-debug-1",
  "report": {
    "schemaVersion": "report-1",
    "run": {
      "id": "018f0f5c-7b2a-7abc-8abc-0123456789ab",
      "specVersion": "0.1",
      "runner": {
        "name": "e2e",
        "version": "0.1.0"
      },
      "status": "failed",
      "exitCode": 1,
      "startedAt": "2026-07-24T12:00:00.000Z",
      "finishedAt": "2026-07-24T12:00:01.000Z",
      "project": {
        "id": "dev.testerarmy.example",
        "configDigest": "0000000000000000000000000000000000000000000000000000000000000000"
      },
      "environment": {
        "ci": false,
        "trustNoticeShown": true,
        "os": "darwin",
        "arch": "arm64",
        "runtime": "node-26.4.0"
      },
      "targets": [
        {
          "id": "web",
          "index": 0,
          "platform": "web",
          "baseOrigin": "https://example.test",
          "environment": "test",
          "engine": {
            "name": "playwright",
            "version": "1.0.0",
            "spiVersion": 1
          },
          "capabilities": [
            "actions",
            "artifacts",
            "location",
            "observation",
            "state",
            "web"
          ],
          "artifactCapabilities": [
            "screenshot",
            "video"
          ],
          "stateCapability": true
        }
      ],
      "serialGroups": [],
      "results": [
        {
          "id": "4bbfd0a6dbf44ac1018dd6ca1a6243d742b24607aa735b28d57541e1128507d3",
          "testId": "tests/example.e2e.ts::opens%20app",
          "kind": "test",
          "tags": [
            "smoke"
          ],
          "declarationIndex": 0,
          "titlePath": [
            "opens app"
          ],
          "file": "tests/example.e2e.ts",
          "source": {
            "file": "tests/example.e2e.ts",
            "line": 3,
            "column": 1
          },
          "targetId": "web",
          "platform": "web",
          "agent": "default",
          "repeat": 0,
          "selected": true,
          "status": "failed",
          "attempts": [
            {
              "id": "018f0f5c-7b2a-7abc-8abc-1123456789ab",
              "index": 0,
              "status": "failed",
              "startedAt": "2026-07-24T12:00:00.000Z",
              "durationMs": 1000,
              "steps": [
                {
                  "id": "018f0f5c-7b2a-7abc-8abc-0123456789ab:0",
                  "index": 0,
                  "kind": "agent",
                  "api": "agent.act",
                  "label": "adds shoes to the cart",
                  "source": {
                    "file": "tests/example.e2e.ts",
                    "line": 3,
                    "column": 1
                  },
                  "status": "passed",
                  "startedAt": "2026-07-24T12:00:00.000Z",
                  "durationMs": 4200,
                  "events": [
                    {
                      "kind": "model",
                      "startedAt": "2026-07-24T12:00:00.100Z",
                      "durationMs": 2840,
                      "status": "passed",
                      "name": "executor",
                      "count": 120,
                      "inputTokens": 100,
                      "outputTokens": 20,
                      "reasoning": "A modal blocks the checkout button; closing it before continuing."
                    },
                    {
                      "kind": "engine",
                      "startedAt": "2026-07-24T12:00:03.000Z",
                      "durationMs": 27,
                      "status": "passed",
                      "name": "tap",
                      "detail": "tap button \"Close\""
                    },
                    {
                      "kind": "navigation",
                      "startedAt": "2026-07-24T12:00:03.100Z",
                      "durationMs": 0,
                      "status": "passed",
                      "detail": "navigated to /cart"
                    },
                    {
                      "kind": "poll",
                      "startedAt": "2026-07-24T12:00:03.200Z",
                      "durationMs": 400,
                      "status": "passed",
                      "name": "expect",
                      "count": 4,
                      "detail": "text \"0 items\" (1 match) x3 -> at 300ms text \"1 item\" (1 match)"
                    }
                  ],
                  "metrics": {
                    "modelCalls": 1,
                    "actionSteps": 1,
                    "observationBytes": 512,
                    "contextBytes": 0,
                    "ledgerBytes": 0
                  },
                  "cache": {
                    "mode": "missed",
                    "reason": "gap",
                    "derived": "minted-token",
                    "replayedActions": 0,
                    "totalActions": 2,
                    "entry": "0123456789abcdef0123456789abcdef0123456789abcdef0123456789abcdef",
                    "detail": "at action 1 of 2, type a value read off the screen",
                    "write": "saved"
                  },
                  "artifacts": [
                    "018f0f5c-7b2a-7abc-8abc-1123456789ab:artifact:0"
                  ],
                  "turns": [
                    {
                      "index": 1,
                      "calls": [
                        "tap({\"target\":\"n19\"})"
                      ],
                      "outcome": "Tapped #n19.\nScreen changes: 4 added."
                    }
                  ]
                },
                {
                  "id": "018f0f5c-7b2a-7abc-8abc-0123456789ab:1",
                  "index": 1,
                  "kind": "agent",
                  "api": "agent.assert",
                  "label": "the result is visible",
                  "source": {
                    "file": "tests/example.e2e.ts",
                    "line": 3,
                    "column": 1
                  },
                  "phase": "afterEach",
                  "screen": {
                    "location": "https://app.example.com/results",
                    "nodes": 12,
                    "since": 0,
                    "changes": [
                      "added heading \"Results\"",
                      "changed status text=\"3 found\" (was: status text=\"searching\")"
                    ]
                  },
                  "status": "failed",
                  "startedAt": "2026-07-24T12:00:00.000Z",
                  "durationMs": 1000,
                  "events": [],
                  "metrics": {
                    "modelCalls": 0,
                    "actionSteps": 0,
                    "observationBytes": 0,
                    "contextBytes": 0,
                    "ledgerBytes": 0
                  },
                  "artifacts": [
                    "018f0f5c-7b2a-7abc-8abc-1123456789ab:artifact:1"
                  ],
                  "error": {
                    "category": "test",
                    "code": "OPERATION_TIMEOUT",
                    "message": "semantic capture timed out",
                    "retryable": false
                  }
                }
              ],
              "artifacts": [
                {
                  "id": "018f0f5c-7b2a-7abc-8abc-1123456789ab:artifact:0",
                  "kind": "screenshot",
                  "mediaType": "image/png",
                  "path": "host/session/screenshots/0.png",
                  "size": 8,
                  "sha256": "aaaaaaaaaaaaaaaaaaaaaaaaaaaaaaaaaaaaaaaaaaaaaaaaaaaaaaaaaaaaaaaa",
                  "redaction": "complete",
                  "producer": {
                    "kind": "step",
                    "stepId": "018f0f5c-7b2a-7abc-8abc-0123456789ab:0"
                  }
                },
                {
                  "id": "018f0f5c-7b2a-7abc-8abc-1123456789ab:artifact:1",
                  "kind": "log",
                  "mediaType": "application/json",
                  "redaction": "incomplete",
                  "producer": {
                    "kind": "step",
                    "stepId": "018f0f5c-7b2a-7abc-8abc-0123456789ab:1"
                  }
                },
                {
                  "id": "018f0f5c-7b2a-7abc-8abc-1123456789ab:artifact:2",
                  "kind": "video",
                  "mediaType": "video/webm",
                  "redaction": "incomplete",
                  "producer": {
                    "kind": "attempt"
                  }
                }
              ],
              "secondaryErrors": [],
              "cleanup": "complete",
              "environment": {
                "browser": "chromium 141.0.7390.37"
              },
              "failure": {
                "url": "http://127.0.0.1:3000/todos",
                "screen": "018f0f5c-7b2a-7abc-8abc-1123456789ab:artifact:0",
                "candidates": [
                  "#n19 button \"Add\""
                ]
              },
              "error": {
                "category": "test",
                "code": "ASSERTION_FAILED",
                "message": "expect.toHaveText failed",
                "retryable": false,
                "phase": "body",
                "details": {
                  "locator": "getByRole(\"status\")",
                  "expected": "text \"2 remaining\"",
                  "observed": "text \"1 remaining\"",
                  "matches": 1
                },
                "source": {
                  "file": "tests/example.e2e.ts",
                  "line": 9,
                  "column": 3
                }
              },
              "appLog": [
                {
                  "source": "network",
                  "level": "error",
                  "text": "POST /api/cart 500 Internal Server Error",
                  "at": "2026-07-24T12:00:03.100Z",
                  "step": 0
                }
              ]